{
  "schema": "kym_tco.gate_registry.v1",
  "registry_id": "s116-gate-registry",
  "registry_version": "1.0",
  "registry_digest": "sha256:672e4ad0d56b2e37a9d099a59488915363aa8a7f73d4e004fdc3d17a3ae5827b",
  "rules": [
    {"rule_id": "RULE-MATERIALIZED", "predicate": "materialization_event_present", "evidence_fields": ["materialization_event_id"]},
    {"rule_id": "RULE-PIPELINE", "predicate": "pipeline_run_declared", "evidence_fields": ["pipeline_run_id"]},
    {"rule_id": "RULE-RAW", "predicate": "input_kind_is_raw", "evidence_fields": ["input_kind", "input_snapshot_ref"]},
    {"rule_id": "RULE-DISCOVERABLE", "predicate": "input_kind_is_repo_or_file_set", "evidence_fields": ["input_kind", "discovery_boundary_ref"]},
    {"rule_id": "RULE-TARGET", "predicate": "target_selected_or_materialized", "evidence_fields": ["target_ref", "target_digest"]},
    {"rule_id": "RULE-KYM", "predicate": "kym_selected_or_materialized", "evidence_fields": ["kym_ref", "kym_digest"]},
    {"rule_id": "RULE-MODEL", "predicate": "tco_model_selected_or_materialized", "evidence_fields": ["model_ref", "model_digest"]},
    {"rule_id": "RULE-COVERAGE", "predicate": "coverage_selected_or_materialized", "evidence_fields": ["coverage_ref", "coverage_digest"]},
    {"rule_id": "RULE-TCO-PAIR", "predicate": "model_coverage_pair_present", "evidence_fields": ["pair_identity"]},
    {"rule_id": "RULE-DASHBOARD-PRESENT", "predicate": "dashboard_input_or_discovery_present", "evidence_fields": ["dashboard_snapshot_ref"]},
    {"rule_id": "RULE-DASHBOARD-DUPLICATE", "predicate": "dashboard_duplicate_finding_present", "evidence_fields": ["duplicate_finding_ref", "governance_decision_ref"]},
    {"rule_id": "RULE-KB-PRESENT", "predicate": "kb_input_or_discovery_present", "evidence_fields": ["kb_snapshot_ref"]},
    {"rule_id": "RULE-GIT-PRESENT", "predicate": "repo_git_metadata_present", "evidence_fields": ["git_boundary_ref"]},
    {"rule_id": "RULE-REPORT", "predicate": "report_projection_requested", "evidence_fields": ["report_request_ref"]},
    {"rule_id": "RULE-FINAL", "predicate": "slice_6_explicitly_authorized", "evidence_fields": ["slice_1_to_5_evidence_refs"]},
    {"rule_id": "RULE-NEVER", "predicate": "not_applicable_for_input_kind", "evidence_fields": ["input_kind", "input_snapshot_ref"]},
    {"rule_id": "RULE-CONDITIONAL", "predicate": "candidate_or_optional_surface_present", "evidence_fields": ["input_snapshot_ref", "materialization_ledger_ref"]},
    {"rule_id": "RULE-MIXED-UNION", "predicate": "union_of_member_input_applicability", "evidence_fields": ["member_input_ids", "member_applicability_refs"]}
  ],
  "gates": [
    {"gate_id": "G-HOST-PROFILE", "stage": "host", "applicability_rule_id": "RULE-MATERIALIZED", "predicate_evidence": ["profile_registry_ref", "materialization_event_id"], "dependencies": [], "required_when_applicable": true},
    {"gate_id": "G-SKILL-IDENTITY", "stage": "host", "applicability_rule_id": "RULE-MATERIALIZED", "predicate_evidence": ["skill_distribution_refs", "skill_digests"], "dependencies": ["G-HOST-PROFILE"], "required_when_applicable": true},
    {"gate_id": "G-ENV-DOCTOR", "stage": "preflight", "applicability_rule_id": "RULE-PIPELINE", "predicate_evidence": ["cli_identity", "tool_probe_ref"], "dependencies": ["G-HOST-PROFILE"], "required_when_applicable": true},
    {"gate_id": "G-SOURCE-NORMALIZE", "stage": "source", "applicability_rule_id": "RULE-RAW", "predicate_evidence": ["input_kind", "input_snapshot_ref"], "dependencies": ["G-ENV-DOCTOR"], "required_when_applicable": true},
    {"gate_id": "G-SOURCE-CLOSURE", "stage": "source", "applicability_rule_id": "RULE-DISCOVERABLE", "predicate_evidence": ["discovery_denominator_ref"], "dependencies": ["G-SOURCE-NORMALIZE"], "required_when_applicable": true},
    {"gate_id": "G-TARGET-VALIDATE", "stage": "target", "applicability_rule_id": "RULE-TARGET", "predicate_evidence": ["target_ref", "target_digest"], "dependencies": ["G-ENV-DOCTOR"], "required_when_applicable": true},
    {"gate_id": "G-KYM-VALIDATE", "stage": "kym", "applicability_rule_id": "RULE-KYM", "predicate_evidence": ["kym_ref", "kym_digest"], "dependencies": ["G-ENV-DOCTOR"], "required_when_applicable": true},
    {"gate_id": "G-KYM-LINT", "stage": "kym", "applicability_rule_id": "RULE-KYM", "predicate_evidence": ["kym_validate_ref"], "dependencies": ["G-KYM-VALIDATE"], "required_when_applicable": true},
    {"gate_id": "G-KYM-AUDIT", "stage": "kym", "applicability_rule_id": "RULE-KYM", "predicate_evidence": ["kym_lint_ref"], "dependencies": ["G-KYM-LINT"], "required_when_applicable": true},
    {"gate_id": "G-KYM-PACKAGE", "stage": "kym", "applicability_rule_id": "RULE-KYM", "predicate_evidence": ["kym_audit_ref"], "dependencies": ["G-KYM-AUDIT"], "required_when_applicable": true},
    {"gate_id": "G-TCO-MODEL-VALIDATE", "stage": "tco", "applicability_rule_id": "RULE-MODEL", "predicate_evidence": ["model_ref", "model_digest"], "dependencies": ["G-ENV-DOCTOR"], "required_when_applicable": true},
    {"gate_id": "G-TCO-COVERAGE-VALIDATE", "stage": "tco", "applicability_rule_id": "RULE-COVERAGE", "predicate_evidence": ["coverage_ref", "coverage_digest"], "dependencies": ["G-ENV-DOCTOR"], "required_when_applicable": true},
    {"gate_id": "G-TCO-VERIFY", "stage": "tco", "applicability_rule_id": "RULE-TCO-PAIR", "predicate_evidence": ["pair_identity"], "dependencies": ["G-TCO-MODEL-VALIDATE", "G-TCO-COVERAGE-VALIDATE"], "required_when_applicable": true},
    {"gate_id": "G-TCO-AUDIT", "stage": "tco", "applicability_rule_id": "RULE-TCO-PAIR", "predicate_evidence": ["verification_ref"], "dependencies": ["G-TCO-VERIFY"], "required_when_applicable": true},
    {"gate_id": "G-TCO-PACKAGE", "stage": "tco", "applicability_rule_id": "RULE-TCO-PAIR", "predicate_evidence": ["audit_ref"], "dependencies": ["G-TCO-AUDIT"], "required_when_applicable": true},
    {"gate_id": "G-TCO-RENDER", "stage": "report", "applicability_rule_id": "RULE-TCO-PAIR", "predicate_evidence": ["package_ref"], "dependencies": ["G-TCO-PACKAGE"], "required_when_applicable": true},
    {"gate_id": "G-DASHBOARD-OBSERVE", "stage": "optional-audit", "applicability_rule_id": "RULE-DASHBOARD-PRESENT", "predicate_evidence": ["dashboard_snapshot_ref"], "dependencies": ["G-SOURCE-NORMALIZE"], "required_when_applicable": true},
    {"gate_id": "G-DASHBOARD-REMEDIATE", "stage": "optional-audit", "applicability_rule_id": "RULE-DASHBOARD-DUPLICATE", "predicate_evidence": ["duplicate_finding_ref", "governance_decision_ref"], "dependencies": ["G-DASHBOARD-OBSERVE"], "required_when_applicable": true},
    {"gate_id": "G-KB-AUDIT", "stage": "optional-audit", "applicability_rule_id": "RULE-KB-PRESENT", "predicate_evidence": ["kb_snapshot_ref"], "dependencies": ["G-SOURCE-NORMALIZE"], "required_when_applicable": true},
    {"gate_id": "G-GIT-FRESHNESS", "stage": "optional-audit", "applicability_rule_id": "RULE-GIT-PRESENT", "predicate_evidence": ["git_boundary_ref"], "dependencies": ["G-SOURCE-NORMALIZE"], "required_when_applicable": true},
    {"gate_id": "G-REPORT-SCHEMA", "stage": "report", "applicability_rule_id": "RULE-REPORT", "predicate_evidence": ["report_schema_ref", "renderer_identity"], "dependencies": ["G-TCO-RENDER"], "required_when_applicable": true},
    {"gate_id": "G-DENOMINATOR-COMPLETE", "stage": "aggregate", "applicability_rule_id": "RULE-PIPELINE", "predicate_evidence": ["registry_digest", "gate_outcome_refs"], "dependencies": [], "required_when_applicable": true},
    {"gate_id": "G-ARTIFACT-INTEGRITY", "stage": "aggregate", "applicability_rule_id": "RULE-PIPELINE", "predicate_evidence": ["artifact_refs", "artifact_digests"], "dependencies": [], "required_when_applicable": true},
    {"gate_id": "G-FINAL-PACKAGE", "stage": "final", "applicability_rule_id": "RULE-FINAL", "predicate_evidence": ["slice_1_to_5_evidence_refs"], "dependencies": ["G-DENOMINATOR-COMPLETE", "G-ARTIFACT-INTEGRITY"], "required_when_applicable": true}
  ],
  "input_kind_applicability": [
    {"input_kind": "repo", "axes": {"normalize": {"expectation": "required", "rule_id": "RULE-RAW"}, "closure": {"expectation": "required", "rule_id": "RULE-DISCOVERABLE"}, "target": {"expectation": "conditional", "rule_id": "RULE-TARGET"}, "kym": {"expectation": "conditional", "rule_id": "RULE-KYM"}, "model": {"expectation": "conditional", "rule_id": "RULE-MODEL"}, "coverage": {"expectation": "conditional", "rule_id": "RULE-COVERAGE"}, "pair": {"expectation": "conditional", "rule_id": "RULE-TCO-PAIR"}, "dashboard": {"expectation": "conditional", "rule_id": "RULE-DASHBOARD-PRESENT"}, "kb": {"expectation": "conditional", "rule_id": "RULE-KB-PRESENT"}, "git": {"expectation": "conditional", "rule_id": "RULE-GIT-PRESENT"}}},
    {"input_kind": "conversation_text", "axes": {"normalize": {"expectation": "required", "rule_id": "RULE-RAW"}, "closure": {"expectation": "not_applicable", "rule_id": "RULE-NEVER"}, "target": {"expectation": "conditional", "rule_id": "RULE-TARGET"}, "kym": {"expectation": "conditional", "rule_id": "RULE-KYM"}, "model": {"expectation": "conditional", "rule_id": "RULE-MODEL"}, "coverage": {"expectation": "conditional", "rule_id": "RULE-COVERAGE"}, "pair": {"expectation": "conditional", "rule_id": "RULE-TCO-PAIR"}, "dashboard": {"expectation": "not_applicable", "rule_id": "RULE-NEVER"}, "kb": {"expectation": "not_applicable", "rule_id": "RULE-NEVER"}, "git": {"expectation": "not_applicable", "rule_id": "RULE-NEVER"}}},